{
  "$schema": "https://json-schema.org/draft/2020-12/schema",
  "$id": "https://heimgewebe/contracts/integrity.summary.schema.json",
  "title": "Integrity Summary Artifact",
  "description": "Zusammenfassender Integritätsbericht (Artefakt). Dient der Diagnose von Behauptung (Claims) vs. Realität (Artifacts) und zeigt Lücken (Loop-Gaps) auf. Dieses Schema ist ein reines Beobachtungsartefakt; automatische Korrektur auf Basis dieses Artefakts ist explizit verboten.",
  "type": "object",
  "required": [
    "repo",
    "generated_at",
    "status",
    "counts"
  ],
  "properties": {
    "repo": {
      "type": "string",
      "description": "Name des Repositories, das den Bericht erzeugt hat."
    },
    "generated_at": {
      "type": "string",
      "format": "date-time",
      "description": "Zeitpunkt der Erzeugung (ISO-8601)."
    },
    "status": {
      "type": "string",
      "enum": [
        "OK",
        "WARN",
        "FAIL",
        "MISSING",
        "UNCLEAR"
      ],
      "description": "Der aggregierte Integritätsstatus des Repositories."
    },
    "counts": {
      "type": "object",
      "description": "Quantitative Zusammenfassung der Integritätsprüfung. Keys sind dynamisch; in der Praxis werden sprechende Bezeichner verwendet, häufig im snake_case-Format (z.B. orphan_outputs oder missing_consumers), aber auch einfachere Namen wie claims, artifacts, loop_gaps oder unclear sind zulässig. Die tatsächliche Menge der verwendeten Keys kann je Repository variieren.",
      "additionalProperties": {
        "type": "integer",
        "minimum": 0
      }
    },
    "details": {
      "type": "object",
      "description": "Detaillierte Auflistung der Integritätsfunde.",
      "additionalProperties": {
        "type": "array",
        "items": {
          "type": "string"
        }
      }
    }
  },
  "additionalProperties": false
}
