{
  "repo": "semantAH",
  "generated_at": "2023-10-27T10:00:00Z",
  "status": "WARN",
  "counts": {
    "claims": 12,
    "artifacts": 5,
    "loop_gaps": 3,
    "unclear": 2
  },
  "details": {
    "claims": [
      "Claim A",
      "Claim B"
    ],
    "artifacts": [
      "Artifact 1"
    ],
    "loop_gaps": [
      "Gap 1",
      "Gap 2",
      "Gap 3"
    ],
    "unclear": [
      "Unclear 1",
      "Unclear 2"
    ]
  }
}
